北海道旭川市神楽四条九丁目,1
岐阜県大垣市多芸島一丁目,1
山形県東根市一本木二丁目,1
新潟県長岡市妙見町,1
京都府京都市北区上賀茂朝露ケ原町,1
福島県福島市下鳥渡水神渕,10
京都府京都市北区衣笠西御所ノ内町,2
大分県大分市大道町一丁目,5
福井県大野市持穴,10
三重県桑名市福江町,1
北海道旭川市九条通二十二丁目,4
北海道白糠郡白糠町東三条北十一丁目,2
宮城県仙台市青葉区錦町一丁目,1
京都府宇治市琵琶台三丁目,2
長野県塩尻市大字金井,4
埼玉県越谷市越ヶ谷五丁目,1
愛知県刈谷市港町七丁目,2
福島県喜多方市関柴町上高額,1
長野県大町市八坂菖蒲,1
滋賀県長浜市新庄寺町,1
北海道士別市東四条北四丁目,1
石川県白山市平松町,1
岐阜県羽島郡笠松町清住町,1
岐阜県大垣市西崎町一丁目,1
千葉県千葉市緑区土気町,1
島根県益田市中島町,1
茨城県龍ヶ崎市佐貫町,5
広島県呉市西中央一丁目,4
山形県鶴岡市下山添庄南,2
福島県郡山市御前南五丁目,1
北海道網走市駒場南三丁目,1
広島県安芸郡海田町寿町,1
愛知県半田市大坪町,1
北海道岩見沢市七条東三丁目,1
茨城県筑西市知行,1
兵庫県淡路市岩屋,4
京都府船井郡京丹波町市森,1
北海道石狩市花川東一条三丁目,1
京都府宮津市字中津,1
奈良県奈良市六条西三丁目,2
宮城県栗原市築館宮野中央二丁目,1
岩手県宮古市八木沢三丁目,2
熊本県熊本市北区下硯川二丁目,1
北海道北見市北八条西一丁目,3
北海道富良野市朝日町,7
北海道旭川市豊岡一条七丁目,3
愛知県豊橋市西赤沢町,1
茨城県結城市大字上成,3
愛媛県宇和島市津島町大浦,1
茨城県稲敷市曲渕,2
富山県小矢部市西町,4
東京都世田谷区船橋一丁目,1
大阪府茨木市東中条町,1
新潟県村上市小谷,5
熊本県熊本市南区野口一丁目,4
兵庫県神戸市中央区栄町通七丁目,1
福岡県大野城市白木原四丁目,10
栃木県那須塩原市横林,1
京都府京都市左京区高野上竹屋町,1
兵庫県神戸市北区有野台三丁目,1
岐阜県関市末広町,2
福島県本宮市荒井膳棚,3
富山県富山市稲荷町一丁目,10
埼玉県加須市愛宕一丁目,1
愛媛県松山市北土居二丁目,6
群馬県前橋市前箱田町二丁目,1
和歌山県田辺市九川,10
大阪府泉南郡岬町孝子,1
長崎県長崎市上野町,1
東京都板橋区赤塚二丁目,1
山形県酒田市北青沢,1
北海道札幌市北区北三十九条西三丁目,1
北海道札幌市東区北十七条東十四丁目,2
広島県広島市西区商工センター一丁目,6
栃木県宇都宮市陽東八丁目,1
福島県福島市飯坂町平野田下,4
兵庫県加古川市別府町新野辺北町一丁目,3
千葉県船橋市習志野台一丁目,2
広島県広島市南区東雲一丁目,3
福岡県筑紫野市杉塚三丁目,2
福島県白河市田島入方,10
長崎県雲仙市瑞穂町西郷乙,1
静岡県静岡市清水区土,5
秋田県男鹿市北浦入道崎家ノ上,1
福岡県大野城市栄町二丁目,1
群馬県渋川市行幸田,5
北海道千歳市自由ケ丘三丁目,1
北海道釧路市阿寒町上阿寒十九線,1
長崎県松浦市調川町,1
大阪府八尾市楽音寺三丁目,1
大阪府高石市羽衣四丁目,7
富山県砺波市庄川町湯山,1
石川県鳳珠郡穴水町字中居南,1
京都府京都市左京区下鴨膳部町,1
奈良県大和郡山市新庄町,1
神奈川県川崎市多摩区登戸新町,1
北海道千歳市栄町四丁目,1
宮崎県日向市向江町二丁目,2
福島県伊達市梁川町舟生馬坂,1
千葉県銚子市栄町三丁目,1
宮城県白石市小下倉,1
神奈川県横浜市南区若宮町四丁目,4
静岡県牧之原市牧之原,1
大分県大分市松原町二丁目,1
山形県山形市小白川町二丁目,1
大分県竹田市大字拝田原,1
福島県二本松市原セ日照田,1
福島県福島市岡島砂入,2
北海道旭川市本町二丁目,1
大阪府大東市新町,10
岐阜県関市池尻,2
京都府亀岡市稗田野町柿花中道,5
広島県庄原市東城町受原,10
北海道札幌市手稲区富丘四条五丁目,1
山形県山形市塚野目,1
京都府京田辺市薪狭道,1
群馬県館林市田谷町,1
富山県射水市中太閤山十四丁目,1
北海道標津郡中標津町西一条南四丁目,1
宮城県宮城郡松島町北小泉,1
兵庫県赤穂郡上郡町宿,3
栃木県栃木市柳橋町,1
埼玉県深谷市新井,1
兵庫県三木市口吉川町槇,2
秋田県秋田市太平中関二番片貝沢,1
大阪府寝屋川市日之出町,1
山形県山形市印役町五丁目,2
北海道赤平市幸町二丁目,1
福岡県福岡市南区弥永一丁目,4
福島県福島市松川町関谷下原,3
山梨県西八代郡市川三郷町山保,7
愛知県半田市岩滑西町三丁目,2
北海道札幌市豊平区平岸五条八丁目,1
滋賀県高島市今津町保坂,1
北海道夕張郡栗山町字滝下,1
新潟県新発田市上内竹,1
兵庫県宝塚市逆瀬台二丁目,2
愛媛県宇和島市本九島,2
千葉県佐倉市大篠塚,1
千葉県船橋市上山町一丁目,2
埼玉県東松山市大字上押垂,1
熊本県熊本市南区合志一丁目,2
北海道旭川市神楽岡二条六丁目,2
茨城県常陸太田市大方町,1
宮城県角田市岡土浮,10
新潟県燕市分水旭町三丁目,3
兵庫県姫路市龍野町一丁目,1
新潟県妙高市大字東菅沼,1
高知県香美市物部町笹,1
愛知県名古屋市中川区柳島町五丁目,1
山形県西置賜郡小国町大字芹出,1
新潟県胎内市本郷,1
愛知県豊田市西細田町,4
岡山県美作市長谷内,3
滋賀県彦根市下矢倉町,1
福島県福島市笹谷北横堀,2
福島県郡山市富田町上西田,1
群馬県渋川市有馬,1
新潟県上越市大字福橋,3
静岡県伊豆の国市白山堂,1
岐阜県岐阜市田端町,1
沖縄県沖縄市胡屋六丁目,1
青森県十和田市元町東五丁目,1
和歌山県田辺市長野,10
石川県七尾市万行町二,1
愛知県半田市白山町二丁目,1
滋賀県大津市瀬田一丁目,4
兵庫県高砂市荒井町蓮池一丁目,2
香川県高松市松福町一丁目,1
新潟県十日町市原町,1
京都府福知山市夜久野町大油子,7
北海道網走市南四条東一丁目,1
高知県香美市土佐山田町宝町三丁目,1
香川県坂出市林田町,1
大阪府寝屋川市成田東町,1
秋田県横手市大雄向田,1
熊本県八代市郡築十番町,1
愛知県豊田市久保町一丁目,4
京都府舞鶴市字女布,1
新潟県長岡市四郎丸二丁目,3
山口県周南市大字夏切,1
北海道札幌市豊平区月寒東二条二十丁目,1
奈良県香芝市関屋北一丁目,6
神奈川県平塚市見附町,1
岩手県大船渡市盛町東町,2
三重県名張市百合が丘西三番町,1
岐阜県岐阜市加納城南通三丁目,1
東京都練馬区光が丘七丁目,2
静岡県富士宮市神田川町,2
埼玉県和光市下新倉四丁目,1
愛媛県宇和島市三間町金銅,1
北海道千歳市北陽五丁目,1
沖縄県中頭郡北谷町字北前,1
愛知県江南市松竹町西瀬古,1
長野県松本市大字洞,1
静岡県牧之原市福岡,6
岩手県遠野市宮守町上鱒沢,1
石川県加賀市別所町三丁目,2
神奈川県川崎市麻生区細山五丁目,1
栃木県宇都宮市五代一丁目,2
岡山県岡山市北区東古松二丁目,1
高知県土佐清水市下ノ加江,2
岐阜県岐阜市入舟町三丁目,2
茨城県下妻市柴,4
北海道砂川市西六条北十四丁目,1
愛知県豊川市山道町二丁目,3
岐阜県岐阜市岩倉町三丁目,1
山形県寒河江市本楯四丁目,1
秋田県秋田市東通五丁目,7
富山県中新川郡上市町中ノ又,2
秋田県大仙市高関上郷諸又,1
宮城県仙台市青葉区堤町二丁目,2
北海道釧路市音別町海光二丁目,1
宮城県仙台市宮城野区榴岡一丁目,3
奈良県奈良市横領町,1
兵庫県神戸市中央区山本通一丁目,1
青森県三沢市東岡三沢一丁目,2
岩手県久慈市夏井町大崎,2
熊本県水俣市深川,3
茨城県稲敷市大島,4
埼玉県越谷市弥栄町四丁目,1
福井県福井市堅達町,1
北海道札幌市手稲区富丘二条五丁目,1
兵庫県尼崎市金楽寺町一丁目,3
埼玉県日高市大字台,1
福岡県糸島市二丈波呂,10
兵庫県佐用郡佐用町土井,1
岡山県赤磐市桜が丘西三丁目,1
岩手県奥州市前沢屋敷,1
大阪府松原市北新町二丁目,10
兵庫県赤穂郡上郡町駅前,1
福島県福島市御山遠背戸,1
岐阜県岐阜市長良一丁目,1
大阪府寝屋川市池田三丁目,1
茨城県笠間市池野辺,1
北海道釧路市阿寒町上仁々志別三十六線,1
兵庫県神戸市北区山田町小部大阪,1
千葉県長生郡長柄町力丸,1
北海道札幌市東区北十六条東十七丁目,2
石川県羽咋郡宝達志水町針山,1
岐阜県各務原市鵜沼川崎町二丁目,1
新潟県見附市元町一丁目,2
京都府京都市伏見区石田川向,1
秋田県湯沢市八幡中島,1
富山県中新川郡立山町寺田ことぶき町,1
兵庫県神戸市長田区菅原通三丁目,1
滋賀県蒲生郡日野町大字北脇,2
熊本県熊本市西区河内町野出,2
北海道札幌市清田区北野一条一丁目,1
北海道標津郡中標津町東二十三条北六丁目,2
奈良県宇陀市榛原福西,1
静岡県袋井市月見町,3
熊本県菊池市豊間,1
岐阜県多治見市光ケ丘二丁目,2
秋田県能代市二ツ井町田代,1
広島県三原市長谷四丁目,4
山形県鶴岡市勝福寺,1
山形県山形市沼の辺町,3
沖縄県島尻郡渡名喜村高田川,1
福島県耶麻郡北塩原村大字関屋,1
福岡県福岡市東区香椎浜一丁目,6
神奈川県横須賀市子安,1
長崎県長崎市多以良町,1
大分県別府市上人仲町,2
山形県東田川郡庄内町深川,1
奈良県葛城市忍海,1
北海道士別市東四条十九丁目,7
東京都練馬区大泉学園町三丁目,3
奈良県橿原市小槻町,1
岐阜県可児市土田,4
大阪府泉佐野市羽倉崎上町一丁目,1
北海道標津郡中標津町西五条南七丁目,1
富山県魚津市大字田地方町,1
千葉県船橋市飯山満町三丁目,1
大分県佐伯市蒲江大字森崎浦,1
広島県福山市沖野上町二丁目,1
兵庫県高砂市神爪六丁目,1
秋田県湯沢市岩崎桂沢,1
秋田県秋田市旭北寺町,1
東京都羽村市富士見平二丁目,1
愛媛県松山市今在家一丁目,6
東京都東久留米市小山一丁目,1
滋賀県長浜市富田町,2
兵庫県南あわじ市八木国分,1
福島県田村市大越町栗出東畑,1
京都府京都市伏見区深草一ノ坪町,1
宮城県仙台市青葉区高野原二丁目,8
長野県長野市信州新町山上条,1
福岡県福岡市南区皿山一丁目,1
宮城県仙台市泉区高森二丁目,1
大阪府茨木市大字安元,3
千葉県柏市南逆井三丁目,1
兵庫県神戸市北区鈴蘭台南町四丁目,3
福島県福島市笹谷中谷地,3
福島県喜多方市山都町早稲谷,1
鳥取県西伯郡大山町殿河内,1
山形県山形市瀬波三丁目,6
北海道札幌市北区北十九条西八丁目,1
宮城県仙台市若林区荒井南,2
北海道石狩市緑苑台東二条一丁目,1
鳥取県倉吉市山根,2
兵庫県神戸市兵庫区水木通六丁目,1
京都府舞鶴市字魚屋,1
奈良県宇陀市榛原天満台東一丁目,1
長崎県長崎市愛宕三丁目,1
北海道旭川市神楽五条二丁目,1
岐阜県岐阜市芥見二丁目,2
愛知県豊田市田町一丁目,6
大阪府枚方市杉一丁目,3
奈良県五條市田園四丁目,3
和歌山県和歌山市西小二里二丁目,3
福島県福島市笹谷前原前,2
長崎県長崎市元船町,1
岡山県岡山市北区東島田町二丁目,1
北海道札幌市東区北三十七条東五丁目,2
京都府南丹市園部町仁江坂田,5
兵庫県加東市出水,3
大阪府大阪市大正区小林東一丁目,1
北海道帯広市大通南十四丁目,3
兵庫県淡路市南鵜崎,1
千葉県君津市宮下,1
愛知県豊田市寿町七丁目,2
福島県福島市荒井古内東,10
新潟県十日町市春日町二丁目,1
青森県三戸郡田子町字平成田,1
北海道旭川市神楽岡十四条九丁目,3
広島県広島市西区草津東二丁目,9
北海道帯広市西六条北七丁目,3
秋田県鹿角郡小坂町小坂中小坂,1
高知県須崎市緑町,5
大阪府大阪市西成区梅南二丁目,2
北海道札幌市手稲区曙二条四丁目,2
大阪府富田林市楠風台二丁目,3
島根県江津市江津町,5
山形県鶴岡市野田目中堰,10
秋田県横手市大雄田村,2
福島県須賀川市西川山本,1
岡山県岡山市東区瀬戸町二日市,2
高知県高知市春野町南ケ丘六丁目,1
北海道網走郡津別町字最上,1
宮城県名取市愛島小豆島島,10
神奈川県相模原市緑区相原二丁目,2
香川県観音寺市大野原町大野原,3
東京都大島町元町,3
広島県呉市広町田二丁目,10
愛知県知多市南粕谷新海一丁目,1
東京都足立区千住柳町,10
三重県伊賀市服部町一丁目,1
北海道石狩市花川南一条四丁目,2
茨城県水戸市若宮町,1
大阪府守口市八雲西町四丁目,1
京都府八幡市八幡長田,4
大阪府高槻市紅茸町,1
茨城県桜川市飯渕,1
北海道旭川市南六条通二十一丁目,2
北海道根室市志発島,1
神奈川県茅ヶ崎市本村四丁目,1
愛知県田原市中山町本田,1
北海道旭川市東光二十条八丁目,1
長崎県諫早市中田町,1
東京都羽村市富士見平三丁目,1
愛知県岡崎市井田新町,9
高知県安芸郡田野町下土生,1
北海道札幌市東区北四十九条東二丁目,1
岡山県井原市大江町,3
愛媛県松山市枝松三丁目,1
京都府京都市山科区竹鼻竹ノ街道町,2
宮城県亘理郡亘理町吉田塩田,1
埼玉県蓮田市大字城,1
富山県高岡市駅南二丁目,1
広島県広島市南区宇品海岸二丁目,3
沖縄県那覇市首里崎山町一丁目,4
愛知県豊川市西塚町二丁目,3
埼玉県熊谷市末広三丁目,2
愛媛県今治市新谷,1
京都府京都市下京区中之町,2
東京都小平市美園町三丁目,2
大分県宇佐市大字東大堀,1
新潟県十日町市会沢,2
高知県高知市弥生町,2
北海道紋別市上渚滑町和訓辺,1
山形県鶴岡市川尻新田,1
岐阜県各務原市大野町七丁目,9
愛知県名古屋市北区城東町四丁目,1
福島県南相馬市鹿島区寺内南町,2
兵庫県洲本市海岸通一丁目,1
北海道札幌市厚別区厚別北一条三丁目,2
愛知県豊橋市佐藤二丁目,2
佐賀県唐津市厳木町天川,2
奈良県大和郡山市北郡山町,6
東京都大島町元町水溜,7
福島県喜多方市字五百苅,4
茨城県笠間市小原,5
東京都立川市砂川町五丁目,2
岩手県滝沢市大沢五郎沢,1
埼玉県八潮市大字伊勢野,1
大阪府大阪市平野区流町三丁目,1
富山県砺波市東別所,1
北海道留萌市見晴町三丁目,1
奈良県橿原市南八木町二丁目,1
茨城県那珂市上河内,2
北海道札幌市豊平区平岸四条九丁目,1
兵庫県加西市青野原町,4
秋田県湯沢市字大島町,1
秋田県秋田市四ツ小屋小阿地上野,1
宮城県岩沼市本町,1
新潟県妙高市大字藤塚新田,1
埼玉県久喜市吉羽四丁目,1
徳島県那賀郡那賀町谷内,1
宮城県角田市小坂堤,1
千葉県市川市塩浜一丁目,1
千葉県浦安市東野二丁目,8
青森県八戸市桔梗野工業団地一丁目,1
山形県酒田市豊里芦原,1
兵庫県相生市竜泉町,1
北海道厚岸郡厚岸町奔渡二丁目,2
石川県金沢市泉本町六丁目,3
山形県東根市若木二条通り,1
岩手県滝沢市鵜飼花平,1
鹿児島県鹿児島市東千石町,4
愛知県春日井市上条町四丁目,1
福島県郡山市日和田町高倉南,1
長野県松本市浅間温泉三丁目,2
兵庫県高砂市高砂町南浜町,10
新潟県長岡市宝一丁目,1
和歌山県和歌山市舟津町二丁目,1
青森県八戸市南白山台一丁目,1
埼玉県鴻巣市三町免,1
宮城県白石市福岡八宮坂町,1
東京都日野市南平三丁目,1
新潟県長岡市寺泊求草,1
富山県富山市下タ林,4
埼玉県比企郡吉見町大字荒子,1
岐阜県大垣市馬の瀬町,1
京都府長岡京市友岡,7
奈良県宇陀市室生瀧谷,1
東京都文京区後楽二丁目,2
大阪府豊中市清風荘二丁目,5
宮城県栗原市栗駒稲屋敷大鳥,2
静岡県伊豆市下船原,1
山形県尾花沢市上町一丁目,1
北海道北広島市山手町五丁目,4
和歌山県紀の川市深田,1
大分県日田市大字花月,1
大阪府大阪狭山市山本北,1
広島県竹原市高崎町,1
宮城県大崎市古川塚目西又,1
三重県伊勢市神久四丁目,1
岡山県井原市美星町明治,1
東京都文京区根津二丁目,6
北海道石狩市花川北一条六丁目,3
愛知県刈谷市小山町三丁目,1
神奈川県厚木市毛利台一丁目,1
兵庫県神戸市灘区篠原南町二丁目,1
高知県高岡郡檮原町本も谷,1
静岡県静岡市駿河区有明町,2
東京都豊島区駒込五丁目,1
奈良県奈良市西大寺町,10
神奈川県横須賀市久里浜台二丁目,1
熊本県阿蘇市赤水,9
青森県八戸市大字妙,1
福岡県豊前市大字恒富,10
高知県高知市元町,1
青森県黒石市大字温湯,1
茨城県常陸大宮市西野内,3
香川県綾歌郡綾川町枌所東,2
高知県高知市薊野南町,3
埼玉県春日部市備後東五丁目,1
広島県江田島市江田島町大須一丁目,6
福島県須賀川市雨田前中山,2
岡山県岡山市東区西大寺五明,1
福岡県柳川市南長柄町,1
神奈川県川崎市宮前区神木本町三丁目,1
岩手県奥州市衣川小正板,1
愛知県半田市柊町一丁目,2
福島県河沼郡会津坂下町字下川前丙,1
兵庫県神戸市中央区旗塚通五丁目,1
大阪府大阪市住之江区南港東四丁目,1
佐賀県伊万里市二里町中里乙,2
京都府京都市上京区東裏辻町,3
神奈川県平塚市千須谷,1
千葉県松戸市五香南二丁目,1
京都府舞鶴市字溝尻,1
福井県敦賀市舞崎町,1
大阪府箕面市箕面三丁目,1
兵庫県神戸市北区西山二丁目,3
千葉県流山市駒木台,1
奈良県五條市野原中一丁目,1
岩手県盛岡市菜園二丁目,1
長崎県佐世保市鹿子前町,1
北海道札幌市手稲区新発寒二条四丁目,2
大阪府大阪市住之江区御崎二丁目,1
静岡県静岡市駿河区中野新田,1
愛知県豊橋市前田町一丁目,1
岡山県岡山市北区高柳東町,2
広島県呉市二河町,10
北海道旭川市永山三条十丁目,1
愛知県碧南市小屋下町一丁目,1
宮城県登米市南方町米袋,4
福島県郡山市大槻町清水内,2
高知県宿毛市宿毛,2
神奈川県横浜市金沢区釜利谷町,1
高知県高知市若草南町,3
千葉県市川市福栄四丁目,1
東京都小平市回田町,1
京都府京田辺市普賢寺奥北谷,1
神奈川県鎌倉市山崎,2
愛知県長久手市下山,1
三重県鈴鹿市野辺二丁目,3
北海道帯広市西六条北一丁目,1
北海道富良野市扇町,10
北海道紋別市上渚滑町奥東,1
新潟県新発田市御幸町一丁目,3
千葉県成田市取香浅間,1
千葉県船橋市高根台三丁目,1
岐阜県岐阜市野一色四丁目,7
北海道網走市南四条西一丁目,1
三重県桑名市野田三丁目,4
熊本県玉名市北牟田,1
新潟県南魚沼市六日町学校町,3
千葉県君津市郡,4
愛知県半田市新生町五丁目,1
愛知県常滑市蒲池町五丁目,1
大阪府堺市堺区戎島町四丁,2
山口県周南市桜馬場通三丁目,3
青森県青森市富田四丁目,1
北海道標津郡標津町南二条西五丁目,1
三重県松阪市嬉野矢下町,5
愛知県豊川市大橋町三丁目,2
宮城県柴田郡柴田町船岡土手内一丁目,1
北海道帯広市西二十二条北五丁目,3
栃木県矢板市泉,6
北海道札幌市豊平区月寒東五条十五丁目,1
北海道上川郡当麻町北星三区,1
愛知県豊橋市大崎町,1
北海道旭川市豊岡二条七丁目,3
岐阜県郡上市八幡町肴町,1
埼玉県川口市鳩ヶ谷本町二丁目,1
新潟県燕市上児木,4
大阪府大阪市都島区都島中通一丁目,1
愛媛県今治市常盤町四丁目,4
兵庫県小野市住吉町,2
愛知県常滑市大谷鴨,1
京都府京都市左京区松ケ崎井出ケ鼻町,10
広島県神石郡神石高原町時安,1
埼玉県草加市新栄一丁目,1
三重県津市藤方,2
兵庫県姫路市飾磨区加茂南,1
奈良県五條市野原西四丁目,2
北海道士別市東八条北四丁目,9
秋田県横手市大沢,1
東京都江東区越中島二丁目,1
岐阜県大垣市川口三丁目,2
宮崎県延岡市東本小路,5
新潟県佐渡市相川味噌屋町,2
宮城県名取市下余田鹿島,3
大阪府東大阪市稲田三島町,5
岩手県二戸市仁左平小山,1
兵庫県豊岡市日撫,2
愛知県刈谷市逢妻町五丁目,1
広島県庄原市平和町,1
秋田県男鹿市北浦北浦北浦,2
東京都神津島村長浜,3
兵庫県淡路市大町畑,1
熊本県菊池市藤田,1
北海道札幌市中央区南五条西五丁目,1
秋田県秋田市豊岩豊巻小林,1
山梨県北杜市長坂町大井ヶ森,1
新潟県妙高市大字飛田新田,1
大阪府大阪狭山市今熊一丁目,1
京都府京都市北区上賀茂六段田町,1
三重県熊野市育生町長井,2
福島県須賀川市稲新城舘,1
徳島県吉野川市山川町塚穴,1
長崎県長崎市見崎町,9
北海道苫小牧市三光町六丁目,2
京都府南丹市園部町船岡,10
京都府京都市上京区蛭子町,1
香川県高松市朝日町三丁目,1
福島県大沼郡会津美里町字本郷,9
高知県高知市朝倉本町一丁目,4
山梨県笛吹市境川町寺尾,2
大分県竹田市大字中,1
青森県五所川原市大字飯詰,1
岩手県盛岡市東緑が丘,4
埼玉県桶川市下日出谷西二丁目,1
福井県鯖江市戸口町,5
徳島県三好市池田町ヤサン,1
福島県郡山市中町,6
徳島県吉野川市山川町黒岩,1
神奈川県小田原市城山一丁目,3
北海道帯広市西十二条南九丁目,3
新潟県上越市大字青野,1
秋田県秋田市河辺戸島三嶽,1
北海道中川郡美深町東一条南八丁目,1
大阪府泉大津市助松町一丁目,10
山梨県甲府市里吉三丁目,1
山形県尾花沢市大字六沢,4
山口県宇部市大字中山,1
栃木県下野市町田,2
千葉県流山市東初石四丁目,1
神奈川県相模原市中央区由野台三丁目,2
北海道札幌市清田区平岡九条三丁目,1
愛知県常滑市坂井狭間,1
大分県佐伯市若宮町,2
埼玉県日高市大字新堀新田,1
愛媛県今治市波止浜一丁目,1
長野県飯田市桜町二丁目,7
福岡県福岡市東区名島一丁目,3
北海道砂川市西五条北六丁目,1
新潟県新潟市南区白根古川,1
大分県中津市大字上宮永,2
山形県鶴岡市栃屋天保恵,3
埼玉県熊谷市赤城町一丁目,2
山口県下関市彦島西山町四丁目,1
大阪府摂津市鳥飼西二丁目,2
熊本県熊本市南区白石町,4
滋賀県栗東市観音寺,1
宮崎県宮崎市東大宮四丁目,10
北海道石狩市親船東一条一丁目,1
兵庫県神戸市灘区篠原中町二丁目,1
長崎県平戸市大石脇町,1
大阪府枚方市渚西二丁目,1
埼玉県新座市片山三丁目,1
宮崎県宮崎市小松台東二丁目,1
山口県周南市中央町,1
福井県福井市舟橋新一丁目,7
福島県福島市北矢野目渋川,10
神奈川県横浜市戸塚区上矢部町,1
広島県福山市大門町三丁目,1
北海道天塩郡豊富町字豊富東四条五丁目,1
和歌山県和歌山市雄松町五丁目,1
山梨県中央市関原,1
広島県三次市作木町岡三渕,1
岐阜県郡上市八幡町五町四丁目,1
新潟県柏崎市西山町長嶺,4
京都府京都市北区紫竹上竹殿町,10
岐阜県羽島郡岐南町徳田三丁目,1
